{
  "$schema": "http://json-schema.org/draft-07/schema#",
  "$id": "https://vientonorte.github.io/schema/edge.schema.json",
  "title": "Arista (Vector) del Grafo de Fricción Institucional",
  "description": "Arista dirigida que representa el flujo de poder, recursos o influencia entre nodos.",
  "type": "object",
  "required": ["id", "source", "target", "weight", "flow_type", "currency", "timestamp"],
  "properties": {
    "id": {
      "type": "string",
      "description": "Identificador único de la arista"
    },
    "source": {
      "type": "string",
      "description": "ID del nodo origen"
    },
    "target": {
      "type": "string",
      "description": "ID del nodo destino"
    },
    "weight": {
      "type": "number",
      "minimum": 0,
      "description": "Peso de la arista: monto monetario o frecuencia de ocurrencia según flow_type"
    },
    "flow_type": {
      "type": "string",
      "enum": ["financiero", "normativo", "personal", "informacional"],
      "description": "Tipo de flujo que representa la arista"
    },
    "currency": {
      "type": "string",
      "pattern": "^[A-Z]{3}$|^N/A$",
      "description": "Código ISO 4217 de la moneda (CLP, USD, etc.) o 'N/A' para flujos no monetarios"
    },
    "timestamp": {
      "type": "string",
      "format": "date-time",
      "description": "Timestamp ISO 8601 de cuando ocurrió el flujo"
    },
    "sca_validated": {
      "type": "boolean",
      "description": "true si el flujo superó la validación SCA analógica (3 factores)"
    },
    "sca_score": {
      "$comment": "OUTPUT: campo calculado por validate_flow.py; solo presente en edges sca_validated:true",
      "type": "integer",
      "minimum": 0,
      "maximum": 100,
      "description": "Score SCA: 100 = supera los 3 factores; 0 = ningún factor validado",
      "$comment": "OUTPUT de validate_flow.py. Solo presente cuando sca_validated=true; no almacenar en edges no validados."
    },
    "friction_type": {
      "$comment": "OUTPUT: campo calculado por validate_flow.py; solo presente en edges sca_validated:true",
      "type": "string",
      "enum": ["limpio", "regulatorio", "procesal", "captura"],
      "description": "Clasificación del flujo post-validación SCA",
      "$comment": "OUTPUT de validate_flow.py. Solo presente cuando sca_validated=true; no almacenar en edges no validados."
    },
    "evidence_refs": {
      "type": "array",
      "items": {
        "type": "string"
      },
      "description": "Referencias a documentos que sustentan esta arista"
    },
    "instrumento_legal": {
      "$comment": "INPUT SCA-2 (HAVE): decreto, resolución o ley habilitante del flujo",
      "type": "string",
      "description": "Factor SCA-2 (HAVE): decreto, resolución o ley habilitante del flujo",
      "$comment": "INPUT del pipeline. Ausencia implica que el Factor 2 no está superado."
    },
    "competencia_validada": {
      "$comment": "INPUT SCA-3 (BE): competencia territorial y jerárquica",
      "type": "boolean",
      "description": "Factor SCA-3 (BE): true si la competencia territorial y jerárquica está validada",
      "$comment": "INPUT del pipeline. Ausencia o false implica que el Factor 3 no está superado."
    },
    "actas_oficios": {
      "$comment": "INPUT SCA-1 (KNOW): evidencia documental del conocimiento de la norma",
      "type": "array",
      "items": { "type": "string" },
      "description": "Factor SCA-1 (KNOW): actas, oficios o minutas que documentan el conocimiento de la norma",
      "$comment": "INPUT del pipeline. Ausencia implica que el Factor 1 no está superado (salvo evidence_refs)."
    }
  },
  "additionalProperties": false
}
